{
  "contract_id": "document-content",
  "contract_version": "1.0.0",
  "artifact": {
    "artifact_id": "a1b2c3d4-e5f6-4a7b-8c9d-0e1f2a3b4c5d",
    "tenant_id": "0a1b2c3d-4e5f-4a6b-8c7d-9e0f1a2b3c4d",
    "uri": "file:///G:/数据/04-审计数据集与基准/PCCA-Benchmark/benchmark_cases/bigcase/BCSA/BCSA_big_01/fault_tickets.json",
    "media_type": "application/json",
    "sha256": "a1b2c3d4e5f67890a1b2c3d4e5f67890a1b2c3d4e5f67890a1b2c3d4e5f67890",
    "size_bytes": 4096,
    "classification": "internal"
  },
  "language": "zh",
  "max_entities": 1000,
  "max_relations": 1000
}